{
  "contractVersion": "0.1.0",
  "id": "api_session_create_unauthorized",
  "description": "Reject a session create request when no authenticated access context is available.",
  "request": {
    "method": "POST",
    "path": "/sessions",
    "headers": {
      "content-type": "application/json"
    },
    "body": {
      "session": {
        "sessionId": "ses_api_fixture_unauthorized_001"
      }
    }
  },
  "response": {
    "status": 401,
    "headers": {
      "content-type": "application/json; charset=utf-8",
      "cache-control": "no-store"
    },
    "body": {
      "error": {
        "code": "unauthorized",
        "message": "resolveAccessContext must return an authenticated access context"
      }
    }
  },
  "notes": [
    "Production adapters should resolve authenticated account, learner link, consent, and trace context before dispatch."
  ]
}
